{
  "action_id": "act_goal1234",
  "kind": "record_decision",
  "scope": "branch:alt",
  "scope_label": "Alternative branch",
  "scope_kind": "branch",
  "title": "Record an inferential goal",
  "basis": {
    "obligation_refs": [
      {
        "kind": "set_inferential_goal",
        "scope": "branch:alt"
      }
    ],
    "node_ids": ["node_fit_alt"]
  },
  "payload": {
    "decision_type": "goal_update",
    "allowed_goal_kinds": ["observable_prediction", "latent_inference"]
  },
  "explanation": {
    "why_now": "Branch-scoped workflow guidance stays blocked until a goal is set.",
    "references": []
  },
  "invocation": {
    "command": "bg_execute_action",
    "args": {
      "action_id": "act_goal1234"
    },
    "prompt": "Describe the inferential goal for this branch:",
    "input": {
      "mode": "non_interactive",
      "fields": {
        "choice": {
          "type": "string",
          "required": true,
          "enum": ["observable_prediction", "latent_inference"],
          "description": "Goal kind to record for the branch."
        },
        "choice_label": {
          "type": "string",
          "required": false,
          "description": "Optional user-facing label for the goal."
        },
        "rationale": {
          "type": "string",
          "required": true,
          "description": "Rationale for the inferential goal."
        }
      }
    }
  },
  "operator_context": {
    "scope_kind": "branch",
    "primary_node_id": "node_fit_alt",
    "primary_branch_id": "branch:alt",
    "focus_node_ids": ["node_fit_alt"],
    "focus_summary_ids": [],
    "focus_branch_ids": ["branch:alt"]
  },
  "metadata": {
    "pack_id": "bayesguide.default_bayesian"
  }
}
